{
  "$schema": "https://json-schema.org/draft/2020-12/schema",
  "$id": "https://research-framework.local/schemas/agent-call-sidecar-1.1.json",
  "title": "AgentCallSidecarV1_1",
  "type": "object",
  "additionalProperties": true,
  "required": [
    "schema_version",
    "stage",
    "agent",
    "agent_kind",
    "tier",
    "status",
    "exit_code",
    "cost_usd",
    "tokens_in",
    "tokens_out",
    "latency_ms",
    "started_at",
    "completed_at",
    "cycle"
  ],
  "properties": {
    "schema_version": { "enum": ["1.1", "1.2"] },
    "cost_source": { "enum": ["runtime", "runtime_tokens", "estimated", "none"] },
    "stage": { "type": "string", "minLength": 1 },
    "agent": { "type": "string", "minLength": 1 },
    "agent_kind": { "enum": ["fake", "real"] },
    "tier": { "type": "string" },
    "status": { "enum": ["ok", "failed"] },
    "exit_code": { "type": "integer" },
    "cost_usd": { "type": "number", "minimum": 0 },
    "tokens_in": { "type": "integer", "minimum": 0 },
    "tokens_out": { "type": "integer", "minimum": 0 },
    "latency_ms": { "type": "integer", "minimum": 0 },
    "started_at": { "type": "string", "format": "date-time" },
    "completed_at": { "type": "string", "format": "date-time" },
    "cycle": { "type": "integer", "minimum": 1 },
    "stderr_excerpt": { "type": "string", "maxLength": 500 },
    "batch_index": { "type": "integer", "minimum": 1 },
    "topic_count": { "type": "integer", "minimum": 0 },
    "duration_ms": { "type": "integer", "minimum": 0 },
    "timed_out": { "type": "boolean" }
  }
}
