{
  "schema_version": "1.1",
  "stage": "scout",
  "agent": "claude",
  "agent_kind": "fake",
  "tier": "standard",
  "status": "ok",
  "exit_code": 0,
  "cost_usd": 0.12,
  "tokens_in": 100,
  "tokens_out": 50,
  "latency_ms": 10,
  "started_at": "2026-01-01T00:00:00Z",
  "completed_at": "2026-01-01T00:00:01Z",
  "cycle": 1
}
