{
  "schema_version": "1.1",
  "stage": "plan_narrator",
  "agent": "claude",
  "agent_kind": "fake",
  "tier": "basic",
  "status": "failed",
  "exit_code": 0,
  "cost_usd": 0.03,
  "tokens_in": 100,
  "tokens_out": 50,
  "latency_ms": 10,
  "started_at": "2026-01-01T00:00:00Z",
  "completed_at": "2026-01-01T00:00:01Z",
  "cycle": 1
}
