{
  "schema_version": "1.1",
  "stage": "research",
  "agent": "codex",
  "agent_kind": "fake",
  "tier": "basic",
  "status": "ok",
  "exit_code": 0,
  "cost_usd": 0.08,
  "tokens_in": 200,
  "tokens_out": 100,
  "latency_ms": 10,
  "started_at": "2026-01-01T00:00:00Z",
  "completed_at": "2026-01-01T00:00:01Z",
  "cycle": 1
}
